{
  "schemaVersion": "1",
  "kind": "building_kit",
  "id": "forest-houses",
  "name": "Forest Houses",
  "prompt": "small timber cottages with mossy roofs and warm brass trim",
  "footprint": {
    "minWidth": 3,
    "maxWidth": 6,
    "minHeight": 3,
    "maxHeight": 5
  },
  "variantCount": 4,
  "license": "MIT"
}
